{
  "anomaly": {
    "anomaly_detected": false,
    "expected_distribution": {
      "00": 0.5,
      "01": 0.0,
      "10": 0.0,
      "11": 0.5
    },
    "finite_shot_guard": 0.05,
    "hellinger_distance": 0.12256123279077795,
    "js_divergence": 0.010526297059033879,
    "message": "Observed distribution differs by TVD=0.037109, which is within the configured threshold=0.050000.",
    "observed_distribution": {
      "00": 0.462890625,
      "01": 0.01953125,
      "10": 0.009765625,
      "11": 0.5078125
    },
    "reason": "No statistically meaningful anomaly detected",
    "shots": 512,
    "threshold": 0.05,
    "total_variation_distance": 0.037109375
  },
  "circuit": {
    "ideal": [
      [
        "h",
        1
      ],
      [
        "cnot",
        1,
        3
      ],
      [
        "measure",
        [
          1,
          3
        ]
      ]
    ],
    "observed": [
      [
        "h",
        1
      ],
      [
        "cnot",
        1,
        3
      ],
      [
        "measure",
        [
          1,
          3
        ]
      ]
    ]
  },
  "configuration": {
    "anomaly_threshold": 0.05,
    "backend_name": null,
    "circuit": [
      [
        "h",
        1
      ],
      [
        "cnot",
        1,
        3
      ],
      [
        "measure",
        [
          1,
          3
        ]
      ]
    ],
    "circuit_family_id": "phase2_cx_q1_q3_readout",
    "circuit_id": "circuit-bdaeb022191a9108",
    "description": "Phase 2 scenario: known q3 readout perturbation below the 0.05 calibration-evidence threshold",
    "experiment_name": "phase2_hardware_readout_q3_subthreshold_seed_20262001",
    "experimental_group_id": "group-38ef5dd3b3366d11",
    "ground_truth_label": "HARDWARE_ANOMALY",
    "hardware_affected_component": "readout q3",
    "hardware_condition_id": "phase2_hardware_readout_q3_subthreshold_condition",
    "hardware_parameters": {
      "coupling_map": [
        [
          1,
          3
        ]
      ],
      "edges": [],
      "gates": [
        {
          "duration": 0.1,
          "error": 0.0,
          "gate": "h",
          "qubits": [
            1
          ]
        },
        {
          "duration": 0.1,
          "error": 0.0,
          "gate": "cx",
          "qubits": [
            1,
            3
          ]
        }
      ],
      "qubits": {
        "0": {
          "readout_error": 0.0,
          "t1": 1000000.0,
          "t2": 1000000.0
        },
        "1": {
          "readout_error": 0.0,
          "t1": 1000000.0,
          "t2": 1000000.0
        },
        "2": {
          "readout_error": 0.0,
          "t1": 1000000.0,
          "t2": 1000000.0
        },
        "3": {
          "readout_error": 0.04,
          "t1": 1000000.0,
          "t2": 1000000.0
        }
      }
    },
    "noise_parameters": null,
    "num_qubits": 4,
    "observed_circuit": null,
    "observed_counts": null,
    "program_fault_description": null,
    "program_fault_id": null,
    "program_fault_operation_index": null,
    "program_fault_qubits": null,
    "random_seed": 20262001,
    "repetition_index": null,
    "run_id": null,
    "shots": 512,
    "validation_label": "SYNTHETIC_VALIDATION"
  },
  "diagnosis": {
    "anomaly_detected": false,
    "category": "NO_ANOMALY",
    "evidence": [
      "Observed distribution differs by TVD=0.037109, which is within the configured threshold=0.050000.",
      "Final distribution difference TVD=0.000000 is within threshold=0.050000.",
      "No qubit, edge, or gate calibration metric crossed the threshold=0.0500."
    ],
    "hardware_evidence_candidates": [],
    "hardware_result": {
      "anomaly_metric": 0.0,
      "candidates": [],
      "evidence": [
        "No qubit, edge, or gate calibration metric crossed the threshold=0.0500."
      ],
      "summary": "No hardware fault candidates exceeded the configured threshold.",
      "threshold": 0.05
    },
    "missing_evidence": [],
    "program_evidence_candidates": [],
    "program_result": {
      "anomaly_metric": 0.0,
      "candidates": [],
      "evidence": [
        "Final distribution difference TVD=0.000000 is within threshold=0.050000."
      ],
      "summary": "No program-level fault was localized; the circuit behavior remains within threshold.",
      "threshold": 0.05
    },
    "statistics_result": {
      "anomaly_detected": false,
      "expected_distribution": {
        "00": 0.5,
        "01": 0.0,
        "10": 0.0,
        "11": 0.5
      },
      "finite_shot_guard": 0.05,
      "hellinger_distance": 0.12256123279077795,
      "js_divergence": 0.010526297059033879,
      "message": "Observed distribution differs by TVD=0.037109, which is within the configured threshold=0.050000.",
      "observed_distribution": {
        "00": 0.462890625,
        "01": 0.01953125,
        "10": 0.009765625,
        "11": 0.5078125
      },
      "reason": "No statistically meaningful anomaly detected",
      "shots": 512,
      "threshold": 0.05,
      "total_variation_distance": 0.037109375
    },
    "summary": "No statistically meaningful execution anomaly or direct fault evidence was detected.",
    "trace_deviation_candidates": []
  },
  "errors": [],
  "execution_metadata": {
    "backend_api_used": false,
    "execution_kind": "SYNTHETIC_VALIDATION",
    "execution_target": "LOCAL_SIMULATOR",
    "generated_at": "2026-10-12T17:09:51+00:00",
    "hardware_model_applied": true,
    "noise_parameters_applied": false,
    "numpy_version": "2.5.3",
    "observation_source": "SEEDED_LOCAL_SIMULATOR_SHOTS_WITH_HARDWARE_MODEL",
    "python_version": "3.12.10",
    "random_seed": 20262001,
    "shots": 512
  },
  "experiment_metadata": {
    "backend_name": null,
    "circuit_family_id": "phase2_cx_q1_q3_readout",
    "circuit_id": "circuit-bdaeb022191a9108",
    "created_at": "2026-10-12T17:09:51+00:00",
    "experiment_name": "phase2_hardware_readout_q3_subthreshold_seed_20262001",
    "experimental_group_id": "group-38ef5dd3b3366d11",
    "ground_truth_label": "HARDWARE_ANOMALY",
    "hardware_affected_component": "readout q3",
    "hardware_condition_id": "phase2_hardware_readout_q3_subthreshold_condition",
    "program_fault_description": null,
    "program_fault_id": null,
    "program_fault_operation_index": null,
    "program_fault_qubits": null,
    "repetition_index": null,
    "run_id": null,
    "validation_label": "SYNTHETIC_VALIDATION"
  },
  "hardware_evidence": {
    "anomaly_metric": 0.0,
    "candidates": [],
    "evidence": [
      "No qubit, edge, or gate calibration metric crossed the threshold=0.0500."
    ],
    "summary": "No hardware fault candidates exceeded the configured threshold.",
    "threshold": 0.05
  },
  "ideal_distribution": {
    "00": 0.5,
    "01": 0.0,
    "10": 0.0,
    "11": 0.5
  },
  "ideal_statevector_distribution": {
    "0000": 0.5,
    "0001": 0.0,
    "0010": 0.0,
    "0011": 0.0,
    "0100": 0.0,
    "0101": 0.5,
    "0110": 0.0,
    "0111": 0.0,
    "1000": 0.0,
    "1001": 0.0,
    "1010": 0.0,
    "1011": 0.0,
    "1100": 0.0,
    "1101": 0.0,
    "1110": 0.0,
    "1111": 0.0
  },
  "observed_counts": {
    "00": 237,
    "01": 10,
    "10": 5,
    "11": 260
  },
  "observed_distribution": {
    "00": 0.462890625,
    "01": 0.01953125,
    "10": 0.009765625,
    "11": 0.5078125
  },
  "program_evidence": {
    "anomaly_metric": 0.0,
    "candidates": [],
    "evidence": [
      "Final distribution difference TVD=0.000000 is within threshold=0.050000."
    ],
    "summary": "No program-level fault was localized; the circuit behavior remains within threshold.",
    "threshold": 0.05
  },
  "reproducibility": {
    "deterministic_localizer_measurements": "measurement operations mapped to barriers for localization only",
    "fingerprint": "76f50ee8606b87e53284b699b1c5dc2cdfdc20a224b7a4b6e35acc3bc14c0b72",
    "fingerprint_excludes": [
      "execution_metadata.generated_at",
      "reproducibility.fingerprint"
    ],
    "random_seed": 20262001,
    "simulator_version": "project-statevector-current"
  },
  "simulator_observed_counts": {
    "00": 237,
    "01": 10,
    "10": 5,
    "11": 260
  },
  "status": "COMPLETED"
}
