{
  "anomaly": {
    "anomaly_detected": false,
    "expected_distribution": {
      "00": 0.0,
      "01": 0.0,
      "10": 1.0,
      "11": 0.0
    },
    "finite_shot_guard": 0.05,
    "hellinger_distance": 0.0,
    "js_divergence": 0.0,
    "message": "Observed distribution differs by TVD=0.000000, which is within the configured threshold=0.050000.",
    "observed_distribution": {
      "00": 0.0,
      "01": 0.0,
      "10": 1.0,
      "11": 0.0
    },
    "reason": "No statistically meaningful anomaly detected",
    "shots": 512,
    "threshold": 0.05,
    "total_variation_distance": 0.0
  },
  "circuit": {
    "ideal": [
      [
        "x",
        0
      ],
      [
        "i",
        0
      ],
      [
        "measure",
        [
          0,
          1
        ]
      ]
    ],
    "observed": [
      [
        "x",
        0
      ],
      [
        "i",
        0
      ],
      [
        "measure",
        [
          0,
          1
        ]
      ]
    ]
  },
  "configuration": {
    "anomaly_threshold": 0.05,
    "backend_name": null,
    "circuit": [
      [
        "x",
        0
      ],
      [
        "i",
        0
      ],
      [
        "measure",
        [
          0,
          1
        ]
      ]
    ],
    "circuit_family_id": "fault_isolation_family_01",
    "circuit_id": "circuit-d31990d7d703c40c",
    "description": "",
    "experiment_name": "fault_isolation_coherence_healthy_control_seed_20261018",
    "experimental_group_id": "group-6c153e09ec005ac6",
    "ground_truth_label": "NORMAL",
    "hardware_affected_component": null,
    "hardware_condition_id": null,
    "hardware_parameters": {
      "coupling_map": [],
      "gates": [
        {
          "duration": 2.0,
          "error": 0.0,
          "gate": "i",
          "qubits": [
            0
          ]
        }
      ],
      "qubits": {
        "0": {
          "readout_error": 0.0,
          "t1": 1000000.0,
          "t2": 1000000.0
        },
        "1": {
          "readout_error": 0.0,
          "t1": 1000000.0,
          "t2": 1000000.0
        }
      }
    },
    "noise_parameters": null,
    "num_qubits": 2,
    "observed_circuit": null,
    "observed_counts": null,
    "program_fault_description": null,
    "program_fault_id": null,
    "program_fault_operation_index": null,
    "program_fault_qubits": null,
    "random_seed": 20261018,
    "repetition_index": null,
    "run_id": null,
    "shots": 512,
    "validation_label": "SYNTHETIC_VALIDATION"
  },
  "diagnosis": {
    "anomaly_detected": false,
    "category": "NO_ANOMALY",
    "evidence": [
      "Observed distribution differs by TVD=0.000000, which is within the configured threshold=0.050000.",
      "Final distribution difference TVD=0.000000 is within threshold=0.050000.",
      "No qubit, edge, or gate calibration metric crossed the threshold=0.0500.",
      "No gate calibration entry is available for x on qubits (0,)."
    ],
    "hardware_evidence_candidates": [],
    "hardware_result": {
      "anomaly_metric": 0.0,
      "candidates": [],
      "evidence": [
        "No qubit, edge, or gate calibration metric crossed the threshold=0.0500."
      ],
      "summary": "No hardware fault candidates exceeded the configured threshold.",
      "threshold": 0.05
    },
    "missing_evidence": [
      "No gate calibration entry is available for x on qubits (0,)."
    ],
    "program_evidence_candidates": [],
    "program_result": {
      "anomaly_metric": 0.0,
      "candidates": [],
      "evidence": [
        "Final distribution difference TVD=0.000000 is within threshold=0.050000."
      ],
      "summary": "No program-level fault was localized; the circuit behavior remains within threshold.",
      "threshold": 0.05
    },
    "statistics_result": {
      "anomaly_detected": false,
      "expected_distribution": {
        "00": 0.0,
        "01": 0.0,
        "10": 1.0,
        "11": 0.0
      },
      "finite_shot_guard": 0.05,
      "hellinger_distance": 0.0,
      "js_divergence": 0.0,
      "message": "Observed distribution differs by TVD=0.000000, which is within the configured threshold=0.050000.",
      "observed_distribution": {
        "00": 0.0,
        "01": 0.0,
        "10": 1.0,
        "11": 0.0
      },
      "reason": "No statistically meaningful anomaly detected",
      "shots": 512,
      "threshold": 0.05,
      "total_variation_distance": 0.0
    },
    "summary": "No statistically meaningful execution anomaly or direct fault evidence was detected.",
    "trace_deviation_candidates": []
  },
  "errors": [],
  "execution_metadata": {
    "backend_api_used": false,
    "execution_kind": "SYNTHETIC_VALIDATION",
    "execution_target": "LOCAL_SIMULATOR",
    "generated_at": "2026-10-12T17:03:13+00:00",
    "hardware_model_applied": true,
    "noise_parameters_applied": false,
    "numpy_version": "2.5.3",
    "observation_source": "SEEDED_LOCAL_SIMULATOR_SHOTS_WITH_HARDWARE_MODEL",
    "python_version": "3.12.10",
    "random_seed": 20261018,
    "shots": 512
  },
  "experiment_metadata": {
    "backend_name": null,
    "circuit_family_id": "fault_isolation_family_01",
    "circuit_id": "circuit-d31990d7d703c40c",
    "created_at": "2026-10-12T17:03:13+00:00",
    "experiment_name": "fault_isolation_coherence_healthy_control_seed_20261018",
    "experimental_group_id": "group-6c153e09ec005ac6",
    "ground_truth_label": "NORMAL",
    "hardware_affected_component": null,
    "hardware_condition_id": null,
    "program_fault_description": null,
    "program_fault_id": null,
    "program_fault_operation_index": null,
    "program_fault_qubits": null,
    "repetition_index": null,
    "run_id": null,
    "validation_label": "SYNTHETIC_VALIDATION"
  },
  "hardware_evidence": {
    "anomaly_metric": 0.0,
    "candidates": [],
    "evidence": [
      "No qubit, edge, or gate calibration metric crossed the threshold=0.0500."
    ],
    "summary": "No hardware fault candidates exceeded the configured threshold.",
    "threshold": 0.05
  },
  "ideal_distribution": {
    "00": 0.0,
    "01": 0.0,
    "10": 1.0,
    "11": 0.0
  },
  "ideal_statevector_distribution": {
    "00": 0.0,
    "01": 0.0,
    "10": 1.0,
    "11": 0.0
  },
  "observed_counts": {
    "10": 512
  },
  "observed_distribution": {
    "00": 0.0,
    "01": 0.0,
    "10": 1.0,
    "11": 0.0
  },
  "program_evidence": {
    "anomaly_metric": 0.0,
    "candidates": [],
    "evidence": [
      "Final distribution difference TVD=0.000000 is within threshold=0.050000."
    ],
    "summary": "No program-level fault was localized; the circuit behavior remains within threshold.",
    "threshold": 0.05
  },
  "reproducibility": {
    "deterministic_localizer_measurements": "measurement operations mapped to barriers for localization only",
    "fingerprint": "d5cc52f2b9daf6b3fe91a38d35f02476a210de6dfe70f9f10d6f6c05efda1d9e",
    "fingerprint_excludes": [
      "execution_metadata.generated_at",
      "reproducibility.fingerprint"
    ],
    "random_seed": 20261018,
    "simulator_version": "project-statevector-current"
  },
  "simulator_observed_counts": {
    "10": 512
  },
  "status": "COMPLETED"
}
