{
  "anomaly": {
    "anomaly_detected": true,
    "expected_distribution": {
      "0": 0.0,
      "1": 1.0
    },
    "finite_shot_guard": 0.05,
    "hellinger_distance": 1.0,
    "js_divergence": 0.6931471805599453,
    "message": "Observed distribution differs from expected distribution by TVD=1.000000, which exceeds threshold=0.050000.",
    "observed_distribution": {
      "0": 1.0,
      "1": 0.0
    },
    "reason": "Distance exceeds configured threshold and finite-shot tolerance",
    "shots": 2048,
    "threshold": 0.05,
    "total_variation_distance": 1.0
  },
  "circuit": {
    "ideal": [
      [
        "h",
        0
      ],
      [
        "z",
        0
      ],
      [
        "h",
        0
      ],
      [
        "measure",
        0
      ]
    ],
    "observed": [
      [
        "h",
        0
      ],
      [
        "x",
        0
      ],
      [
        "h",
        0
      ],
      [
        "measure",
        0
      ]
    ]
  },
  "configuration": {
    "anomaly_threshold": 0.05,
    "backend_name": null,
    "circuit": [
      [
        "h",
        0
      ],
      [
        "z",
        0
      ],
      [
        "h",
        0
      ],
      [
        "measure",
        0
      ]
    ],
    "circuit_family_id": "hzh_sequence",
    "circuit_id": "circuit-b18251eb1ebcf6f1",
    "description": "",
    "experiment_name": "pilot_hzh_sequence_program_fault_rep0",
    "experimental_group_id": "group-2bf0c70c0d601aa9",
    "ground_truth_label": "PROGRAM_FAULT",
    "hardware_condition_id": null,
    "hardware_parameters": null,
    "noise_parameters": null,
    "num_qubits": 1,
    "observed_circuit": [
      [
        "h",
        0
      ],
      [
        "x",
        0
      ],
      [
        "h",
        0
      ],
      [
        "measure",
        0
      ]
    ],
    "observed_counts": null,
    "program_fault_id": "hzh_replace_z_with_x_v1",
    "random_seed": 73210,
    "repetition_index": 0,
    "run_id": "run-32cca64ca7014251",
    "shots": 2048,
    "validation_label": "SYNTHETIC_VALIDATION"
  },
  "diagnosis": {
    "anomaly_detected": true,
    "category": "PROGRAM_FAULT",
    "evidence": [
      "Observed distribution differs from expected distribution by TVD=1.000000, which exceeds threshold=0.050000.",
      "Step 1: expected z(0,)() but observed x(0,)()",
      "Mismatch score = 0.50",
      "Hardware calibration information was not provided."
    ],
    "hardware_evidence_candidates": [],
    "hardware_result": null,
    "missing_evidence": [
      "Hardware calibration information was not provided."
    ],
    "program_evidence_candidates": [
      {
        "actual_signature": [
          "x",
          [
            0
          ],
          []
        ],
        "evidence": [
          "Step 1: expected z(0,)() but observed x(0,)()",
          "Mismatch score = 0.50"
        ],
        "expected_signature": [
          "z",
          [
            0
          ],
          []
        ],
        "index": 1,
        "operation": "x",
        "qubits": [
          0
        ],
        "reason": "Gate operation differs from expected circuit",
        "score": 0.5
      }
    ],
    "program_result": {
      "anomaly_metric": 1.0,
      "candidates": [
        {
          "actual_signature": [
            "x",
            [
              0
            ],
            []
          ],
          "evidence": [
            "Step 1: expected z(0,)() but observed x(0,)()",
            "Mismatch score = 0.50"
          ],
          "expected_signature": [
            "z",
            [
              0
            ],
            []
          ],
          "index": 1,
          "operation": "x",
          "qubits": [
            0
          ],
          "reason": "Gate operation differs from expected circuit",
          "score": 0.5
        }
      ],
      "evidence": [
        "Step 1: expected z(0,)() but observed x(0,)()",
        "Mismatch score = 0.50"
      ],
      "summary": "Program fault localization identified the following likely offending operation(s): step 1 (x)",
      "threshold": 0.05
    },
    "statistics_result": {
      "anomaly_detected": true,
      "expected_distribution": {
        "0": 0.0,
        "1": 1.0
      },
      "finite_shot_guard": 0.05,
      "hellinger_distance": 1.0,
      "js_divergence": 0.6931471805599453,
      "message": "Observed distribution differs from expected distribution by TVD=1.000000, which exceeds threshold=0.050000.",
      "observed_distribution": {
        "0": 1.0,
        "1": 0.0
      },
      "reason": "Distance exceeds configured threshold and finite-shot tolerance",
      "shots": 2048,
      "threshold": 0.05,
      "total_variation_distance": 1.0
    },
    "summary": "An execution anomaly is accompanied by program-operation fault evidence."
  },
  "errors": [],
  "execution_metadata": {
    "backend_api_used": false,
    "execution_kind": "SYNTHETIC_VALIDATION",
    "execution_target": "LOCAL_SIMULATOR",
    "generated_at": "2026-10-07T05:23:57+00:00",
    "hardware_model_applied": false,
    "noise_parameters_applied": false,
    "numpy_version": "2.5.3",
    "observation_source": "SEEDED_LOCAL_SIMULATOR_SHOTS",
    "python_version": "3.12.10",
    "random_seed": 73210,
    "shots": 2048
  },
  "experiment_metadata": {
    "backend_name": null,
    "circuit_family_id": "hzh_sequence",
    "circuit_id": "circuit-b18251eb1ebcf6f1",
    "created_at": "2026-10-07T05:23:57+00:00",
    "experiment_name": "pilot_hzh_sequence_program_fault_rep0",
    "experimental_group_id": "group-2bf0c70c0d601aa9",
    "ground_truth_label": "PROGRAM_FAULT",
    "hardware_condition_id": null,
    "program_fault_id": "hzh_replace_z_with_x_v1",
    "repetition_index": 0,
    "run_id": "run-32cca64ca7014251",
    "validation_label": "SYNTHETIC_VALIDATION"
  },
  "hardware_evidence": null,
  "ideal_distribution": {
    "0": 0.0,
    "1": 1.0
  },
  "ideal_statevector_distribution": {
    "0": 0.0,
    "1": 1.0
  },
  "observed_counts": {
    "0": 2048
  },
  "observed_distribution": {
    "0": 1.0,
    "1": 0.0
  },
  "program_evidence": {
    "anomaly_metric": 1.0,
    "candidates": [
      {
        "actual_signature": [
          "x",
          [
            0
          ],
          []
        ],
        "evidence": [
          "Step 1: expected z(0,)() but observed x(0,)()",
          "Mismatch score = 0.50"
        ],
        "expected_signature": [
          "z",
          [
            0
          ],
          []
        ],
        "index": 1,
        "operation": "x",
        "qubits": [
          0
        ],
        "reason": "Gate operation differs from expected circuit",
        "score": 0.5
      }
    ],
    "evidence": [
      "Step 1: expected z(0,)() but observed x(0,)()",
      "Mismatch score = 0.50"
    ],
    "summary": "Program fault localization identified the following likely offending operation(s): step 1 (x)",
    "threshold": 0.05
  },
  "reproducibility": {
    "deterministic_localizer_measurements": "measurement operations mapped to barriers for localization only",
    "fingerprint": "4b45bba556d721b72ff81a642ce9e8b51ca340c849e974ab26bcdd8c70bff18f",
    "fingerprint_excludes": [
      "execution_metadata.generated_at",
      "reproducibility.fingerprint"
    ],
    "random_seed": 73210,
    "simulator_version": "project-statevector-current"
  },
  "simulator_observed_counts": {
    "0": 2048
  },
  "status": "COMPLETED"
}
